{
  "test_id": "CALC-702",
  "test_title": "Full calculation via keyboard only",
  "test_def_hash": "3529d59f",
  "run": {
    "started_at": "2026-06-09T16:32:18+01:00",
    "finished_at": "2026-06-09T16:32:18+01:00",
    "duration_seconds": 0,
    "user": "sarajoananeves@gmail.com",
    "git_commit": "5658ad4"
  },
  "environment": {
    "browser": "chrome",
    "os": "macOS (Darwin 25.4.0)"
  },
  "outcome": {
    "overall": "fail",
    "failed_at_step": 5,
    "notes": "Calculation flow via keyboard worked end to end (typed 3, selected operator -, typed -2, pressed Enter on Calculate -> Result: 5). Step 5 failed: the result field did not clear. It stayed populated when typing in or clearing any of the number fields. Pass criterion 'clearing an input resets the result' is not met."
  },
  "steps": [
    { "n": 1, "status": "pass" },
    { "n": 2, "status": "pass" },
    { "n": 3, "status": "pass" },
    { "n": 4, "status": "pass" },
    { "n": 5, "status": "fail", "description": "Result field did not clear. Clearing/editing any number field (Cmd+A + Delete on first number, or typing in any number field) left the previous result displayed instead of resetting to the empty state.", "patterns_offered": ["control-not-responsive"] }
  ]
}
