{
  "test_id": "CALC-702",
  "test_title": "Full calculation via keyboard only",
  "test_def_hash": "88cdbd3c",
  "run": {
    "started_at": "2026-06-09T14:32:48Z",
    "finished_at": "2026-06-09T14:32:48Z",
    "duration_seconds": 0,
    "user": "sarajoananeves@gmail.com",
    "git_commit": "5658ad4"
  },
  "environment": {
    "browser": "chrome",
    "os": "macOS"
  },
  "outcome": {
    "overall": "pass",
    "notes": "Recovery from earlier failure today. Operator selector now changeable via keyboard (Up/Down arrows selecting -). Step 4 gave Result: 5."
  },
  "steps": [
    { "n": 1, "status": "pass" },
    { "n": 2, "status": "pass" },
    { "n": 3, "status": "pass" },
    { "n": 4, "status": "pass" },
    { "n": 5, "status": "pass" }
  ]
}