{
  "test_id": "CALC-702",
  "test_title": "Full calculation via keyboard only",
  "test_def_hash": "bdced260",
  "run": {
    "started_at": "2026-06-09T16:06:00Z",
    "finished_at": "2026-06-09T16:06:00Z",
    "duration_seconds": 0,
    "user": "sarajoananeves@gmail.com",
    "git_commit": "5658ad4"
  },
  "environment": {
    "browser": "chrome",
    "os": "macOS"
  },
  "outcome": {
    "overall": "pass",
    "notes": "All 5 steps pass. Step 5 — clearing the first number field now resets the result to the placeholder — which failed in earlier runs, is now passing."
  },
  "steps": [
    { "n": 1, "status": "pass" },
    { "n": 2, "status": "pass" },
    { "n": 3, "status": "pass" },
    { "n": 4, "status": "pass" },
    { "n": 5, "status": "pass" }
  ]
}
