{
  "test_id": "CALC-702",
  "test_title": "Full calculation via keyboard only",
  "test_def_hash": "3529d59f",
  "run": {
    "started_at": "2026-06-09T19:09:00Z",
    "finished_at": "2026-06-09T19:09:00Z",
    "duration_seconds": 0,
    "user": "sarajoananeves@gmail.com",
    "git_commit": "5658ad4"
  },
  "environment": {
    "browser": "chrome",
    "os": "macOS 26.4.1"
  },
  "outcome": {
    "overall": "pass",
    "notes": "All 5 steps passed. Steps 2 (operator selection via Up/Down arrows) and 5 (clear input resets result) have been flaky in the past but passed this run."
  },
  "steps": [
    { "n": 1, "status": "pass" },
    { "n": 2, "status": "pass" },
    { "n": 3, "status": "pass" },
    { "n": 4, "status": "pass" },
    { "n": 5, "status": "pass" }
  ]
}
