{
  "test_id": "CALC-702",
  "test_title": "Full calculation via keyboard only",
  "test_def_hash": "3529d59f",
  "run": {
    "started_at": "2026-06-09T14:38:17+0100",
    "finished_at": "2026-06-09T14:38:17+0100",
    "duration_seconds": 0,
    "user": "sarajoananeves@gmail.com",
    "git_commit": "5658ad4"
  },
  "environment": {
    "browser": "chrome",
    "os": "macOS"
  },
  "outcome": {
    "overall": "fail",
    "failed_at_step": 2,
    "notes": "Operator control is stuck on the default '+' and does not respond to Up/Down arrow keys; cannot select '-' via keyboard. The calc mechanism itself works: typing '-2' into the second number succeeded (step 3), and Calculate/Enter ran correctly, producing 1 (3 + (-2) = 1) instead of the expected Result: 5. Issue is isolated to keyboard-driven operator selection. Step 5 (clear/reset) was not reached."
  },
  "steps": [
    { "n": 1, "status": "pass" },
    {
      "n": 2,
      "status": "fail",
      "description": "Operator field stuck on default '+'. Up/Down arrow keys do not change it to '-'. Tab focus and typing work elsewhere, but this control does not respond to keyboard arrow input.",
      "patterns_offered": ["control-not-responsive"]
    },
    { "n": 3, "status": "pass" },
    { "n": 4, "status": "pass" }
  ]
}