{
  "test_id": "CALC-702",
  "test_title": "Full calculation via keyboard only",
  "test_def_hash": "3529d59f",
  "run": {
    "started_at": "2026-06-09T17:09:59+0100",
    "finished_at": "2026-06-09T17:09:59+0100",
    "duration_seconds": 0,
    "user": "sara.neves@8x8.com",
    "git_commit": "5658ad4"
  },
  "environment": {
    "browser": "chrome",
    "os": "macOS"
  },
  "outcome": {
    "overall": "fail",
    "failed_at_step": 2,
    "notes": "Keyboard-only operator selection is completely broken. The operator selector receives focus but does not respond to Up/Down/arrow keys at all — it stays stuck on the default `+`. This affects ALL non-default operators, not just `-`: × and / could not be tested because no non-default operator can be selected via keyboard. The Calculate/Enter mechanism itself works (Enter triggers the calculation), but because the operator is stuck on `+`, step 4 produced Result: 1 (3 + -2) instead of the expected 5. Clearing the first number (Cmd+A + Delete) correctly resets the result to `—`. control-not-responsive pattern Try items already covered by observations: focus is received, default value works, failure is page-wide for keyboard input on this control across all non-default options."
  },
  "steps": [
    { "n": 1, "status": "pass" },
    {
      "n": 2,
      "status": "fail",
      "description": "Up/Down arrows do not change the operator at all — stuck on default `+`. The control receives focus but does not respond to keyboard input. Fails for all non-default operators (× and / unselectable via keyboard too).",
      "patterns_offered": ["control-not-responsive"]
    },
    { "n": 3, "status": "pass" },
    {
      "n": 4,
      "status": "fail",
      "description": "Calculate/Enter mechanism works (Enter triggers calculation), but operator stuck on default `+` yields Result: 1 (3 + -2) instead of the expected 5. Fails as written."
    },
    { "n": 5, "status": "pass" }
  ]
}